{
  "$schema": "https://json-schema.org/draft/2020-12/schema",
  "$id": "https://schemas.punar.dev/v1alpha1/desired-state/desired-state.json",
  "title": "DeviceDesiredState",
  "description": "Declarative desired-state document that Smplify (the enterprise control plane) sends to a Punar device (spec sections 38, 50). Models the full section 38 example plus the firewall defaults of section 44.4 and the application policy of section 46. This is a YAML configuration manifest: field names are camelCase per the repo naming asymmetry (schemas/README.md); the apiVersion string is validated verbatim.",
  "type": "object",
  "properties": {
    "apiVersion": {
      "title": "API version",
      "description": "Manifest API version, verbatim from spec section 38. Independent of the schema-tree version (schemas/README.md, Versioning).",
      "const": "smplify.io/v1alpha1"
    },
    "kind": {
      "title": "Kind",
      "description": "Document kind (spec section 38).",
      "const": "DeviceDesiredState"
    },
    "metadata": {
      "title": "Metadata",
      "description": "Identifies the organization and the device this desired state targets (spec section 38).",
      "type": "object",
      "properties": {
        "organization": {
          "title": "Organization",
          "description": "Organization identifier, e.g. 'acme' (spec sections 38, 47). Kept as a non-empty string: the spec shows a bare slug and defines no organization-id grammar.",
          "type": "string",
          "minLength": 1
        },
        "device": {
          "title": "Device id",
          "description": "Target device identifier, 'dev_' prefix (spec sections 38, 53).",
          "$ref": "https://schemas.punar.dev/v1alpha1/common/defs.json#/$defs/device_id"
        }
      },
      "required": ["organization", "device"],
      "additionalProperties": false
    },
    "spec": {
      "title": "Desired state spec",
      "description": "Desired configuration for the device (spec section 38). All five sections are present in the section 38 example — the only full DeviceDesiredState example — and are therefore required; relaxing a required field later is a compatible change (schemas/README.md, Versioning).",
      "type": "object",
      "properties": {
        "security": {
          "title": "Security baseline",
          "description": "Enterprise security baseline settings (spec sections 38, 44). Extensible object: spec section 44.5 says enterprise policy should also govern service controls (SSH, Bluetooth, removable storage, local admin, screen lock, kernel/module restrictions, developer exceptions), so unknown keys are permitted here. Only 'firewall' is required: the section 44.4 declarative example shows a security block containing only 'firewall'.",
          "type": "object",
          "properties": {
            "diskEncryption": {
              "title": "Disk encryption",
              "description": "Disk-encryption requirement for this device (spec sections 38, 44.2).",
              "type": "object",
              "properties": {
                "required": {
                  "title": "Disk encryption required",
                  "description": "Whether disk encryption is required on this device (spec sections 38, 44.2).",
                  "type": "boolean"
                },
                "recoveryKeyEscrow": {
                  "title": "Recovery-key escrow",
                  "description": "Organization policy for automatic escrow of a device-generated LUKS recovery key. The key is wrapped to the tenant recovery public key before leaving the device and never enters policy, logs, argv, environment variables, or persisted plaintext.",
                  "type": "object",
                  "properties": {
                    "enabled": {
                      "title": "Escrow enabled",
                      "description": "Require an enrolled device to wrap and escrow its disk recovery key to Smplify. Personal devices never inherit this setting.",
                      "type": "boolean"
                    }
                  },
                  "required": ["enabled"],
                  "additionalProperties": false
                }
              },
              "required": ["required"],
              "additionalProperties": false
            },
            "secureBoot": {
              "title": "Secure Boot",
              "description": "Secure Boot requirement for this device (spec sections 38, 44.1).",
              "type": "object",
              "properties": {
                "required": {
                  "title": "Secure Boot required",
                  "description": "Whether Secure Boot is required on this device (spec sections 38, 44.1).",
                  "type": "boolean"
                }
              },
              "required": ["required"],
              "additionalProperties": false
            },
            "firewall": {
              "title": "Firewall",
              "description": "Firewall desired state (spec sections 38, 44.4).",
              "type": "object",
              "properties": {
                "enabled": {
                  "title": "Firewall enabled",
                  "description": "Whether the firewall is enabled (spec sections 38, 44.4).",
                  "type": "boolean"
                },
                "inboundDefault": {
                  "title": "Inbound default verdict",
                  "description": "Default verdict for inbound traffic (spec section 44.4). Optional: present in the section 44.4 example, absent from the section 38 example.",
                  "$ref": "#/$defs/firewall_default"
                },
                "outboundDefault": {
                  "title": "Outbound default verdict",
                  "description": "Default verdict for outbound traffic (spec section 44.4). Optional: present in the section 44.4 example, absent from the section 38 example.",
                  "$ref": "#/$defs/firewall_default"
                }
              },
              "required": ["enabled"],
              "additionalProperties": false
            },
            "localAdmin": {
              "title": "Local administration",
              "description": "Whether the device's own administrator may edit local policy (spec section 44.5 lists local admin among the service controls enterprise policy governs). Absent means the organization has no opinion and the device's owner administers it, which is the state of every unenrolled device. punard reads this as a provenance-tagged layer: the best-ranked opinion governs, and a value outside the enum refuses daemon start rather than falling back to the permissive default.",
              "type": "object",
              "properties": {
                "policyEditing": {
                  "title": "Local policy editing",
                  "description": "'allowed' lets a re-authenticated administrator record device_specific_override entries through policy.set (docs/api/ipc.md section 5.8a); 'denied' turns that route off, and the refusal names this policy. Neither value affects what the organization's own layers pin: those outrank the local administrator either way.",
                  "enum": ["allowed", "denied"]
                },
                "administrators": {
                  "title": "Device administrators",
                  "description": "Who may take actions that reach other people on this device while it is enrolled (docs/api/ipc.md section 23.4): device policy, updates, enrollment, other people's processes and sessions. Absent means the organization has no opinion and the device's own administrators (group punar-admin; the first onboarded account holds it) decide. 'local' states that explicitly; 'pinned' names exactly the accounts that administer the device, and the device's own list is kept but has no effect; 'none' turns local administration off, so only root and the organization act. Leaving an enrollment the organization made removable always follows the device's own list, whatever this says. A present-but-unreadable value refuses daemon start rather than falling back to the device's own list.",
                  "type": "object",
                  "properties": {
                    "mode": {
                      "title": "Mode",
                      "enum": ["local", "pinned", "none"]
                    },
                    "accounts": {
                      "title": "Pinned administrators",
                      "description": "Account names on the device, required with mode 'pinned' and refused with any other mode.",
                      "type": "array",
                      "minItems": 1,
                      "uniqueItems": true,
                      "items": {
                        "type": "string",
                        "pattern": "^[a-z_][a-z0-9_-]{0,31}$"
                      }
                    }
                  },
                  "required": ["mode"],
                  "additionalProperties": false,
                  "if": {"properties": {"mode": {"const": "pinned"}}},
                  "then": {"required": ["accounts"]},
                  "else": {"not": {"required": ["accounts"]}}
                }
              },
              "required": ["policyEditing"],
              "additionalProperties": false
            }
          },
          "required": ["firewall"],
          "additionalProperties": true
        },
        "applications": {
          "title": "Application policy",
          "description": "Application policy (spec sections 38, 46). 'required' appears in both spec examples and is required here; 'denied' and 'allowUserInstall' appear only in the section 46 example and are optional. Strict object: spec section 46 says application semantics should remain stable even if the underlying package system changes.",
          "type": "object",
          "properties": {
            "required": {
              "title": "Required applications",
              "description": "Applications that must be installed, by package name (spec sections 38, 46).",
              "type": "array",
              "items": {
                "title": "Required application package name",
                "description": "Package name of an application that must be installed (spec sections 38, 46).",
                "$ref": "#/$defs/package_name"
              }
            },
            "denied": {
              "title": "Denied applications",
              "description": "Native packages or canonical web origins that must not be installed (spec section 46; milestone 11 section 4.4). Exactly one identity kind is present per entry.",
              "type": "array",
              "items": {
                "title": "Denied application entry",
                "description": "A denied native package or browser origin. Origin policy is enforced by Chromium's root-owned managed policy file; package policy remains the native lifecycle gate.",
                "type": "object",
                "properties": {
                  "package": {
                    "title": "Denied package name",
                    "description": "Package name of an application that must not be installed (spec section 46).",
                    "$ref": "#/$defs/package_name"
                  },
                  "origin": {
                    "title": "Denied web origin",
                    "description": "Canonical lower-case HTTPS origin, with no path, query, fragment, credentials, or trailing slash. The local file:// value exists only for offline fixture policy.",
                    "$ref": "#/$defs/web_origin"
                  }
                },
                "oneOf": [
                  {"required": ["package"]},
                  {"required": ["origin"]}
                ],
                "additionalProperties": false
              }
            },
            "web_apps": {
              "title": "Required browser-backed applications",
              "description": "Strict, offline Punar web-app records required by organization policy (milestone 11 section 4.6). The daemon derives and matches each origin from start_url; no manifest is fetched from the network.",
              "type": "object",
              "properties": {
                "required": {
                  "type": "array",
                  "items": {
                    "$ref": "https://schemas.punar.org/browser/web-app-manifest.json"
                  },
                  "uniqueItems": true
                }
              },
              "required": ["required"],
              "additionalProperties": false
            },
            "allowUserInstall": {
              "title": "Allow user installs",
              "description": "Whether users may install additional applications themselves (spec section 46).",
              "type": "boolean"
            }
          },
          "required": ["required"],
          "additionalProperties": false
        },
        "browser": {
          "title": "Chromium mandatory policy",
          "description": "Optional root-owned Chromium managed-policy block (milestone 11 section 6). This is a closed vocabulary mirrored by browser/integration/policy-allowlist.json; security-hardening values are one-direction pins and cannot be weakened by an organization layer.",
          "type": "object",
          "minProperties": 1,
          "properties": {
            "ExtensionInstallBlocklist": {"$ref": "#/$defs/browser_string_list"},
            "ExtensionInstallAllowlist": {"$ref": "#/$defs/browser_string_list"},
            "ExtensionInstallForcelist": {"$ref": "#/$defs/browser_string_list"},
            "ExtensionSettings": {"type": "object"},
            "WebAppInstallForceList": {
              "type": "array",
              "maxItems": 256,
              "items": {"$ref": "#/$defs/chromium_web_app_install"}
            },
            "WebAppSettings": {
              "type": "array",
              "maxItems": 256,
              "items": {"$ref": "#/$defs/chromium_web_app_setting"}
            },
            "WebAppInstallByUserEnabled": {"type": "boolean"},
            "URLBlocklist": {"$ref": "#/$defs/browser_string_list"},
            "URLAllowlist": {"$ref": "#/$defs/browser_string_list"},
            "DownloadRestrictions": {"type": "integer", "minimum": 0, "maximum": 4},
            "DownloadDirectory": {"type": "string", "minLength": 1, "maxLength": 4096},
            "PromptForDownloadLocation": {"type": "boolean"},
            "CACertificates": {"$ref": "#/$defs/browser_string_list"},
            "SitePerProcess": {"const": true},
            "RemoteDebuggingAllowed": {"const": false},
            "SSLErrorOverrideAllowed": {"const": false},
            "InsecurePrivateNetworkRequestsAllowed": {"const": false}
          },
          "additionalProperties": false
        },
        "ai": {
          "title": "AI policy",
          "description": "AI configuration for the device (spec section 38). Extensible object: spec section 71 sketches future keys under 'ai' (models, cloudModels, localModels, externalMcp), so unknown keys are permitted here.",
          "type": "object",
          "properties": {
            "policy": {
              "title": "AI policy name",
              "description": "Name of the named AI policy applied to this device, e.g. 'engineering-standard' (spec sections 38, 20).",
              "type": "string",
              "minLength": 1
            }
          },
          "required": ["policy"],
          "additionalProperties": true
        },
        "network": {
          "title": "Network",
          "description": "Network desired state (spec sections 38, 33).",
          "type": "object",
          "properties": {
            "privateRelay": {
              "title": "Private relay",
              "description": "Native OS-level private relay configuration (spec sections 38, 33).",
              "type": "object",
              "properties": {
                "enabled": {
                  "title": "Private relay enabled",
                  "description": "Whether the native private relay is enabled (spec sections 38, 33).",
                  "type": "boolean"
                }
              },
              "required": ["enabled"],
              "additionalProperties": false
            }
          },
          "required": ["privateRelay"],
          "additionalProperties": false
        },
        "update": {
          "title": "Update",
          "description": "Update configuration (spec sections 38, 57).",
          "type": "object",
          "properties": {
            "channel": {
              "title": "Update channel",
              "description": "Punar whole-image update channel (spec sections 38, 57): stable is the default and longest-soak channel, dev promotes faster after initial canary evidence, and edge is the earliest complete signed image after the full gate. The channel never selects a partial package transaction.",
              "type": "string",
              "enum": ["stable", "dev", "edge"]
            }
          },
          "required": ["channel"],
          "additionalProperties": false
        }
      },
      "required": ["security", "applications", "ai", "network", "update"],
      "additionalProperties": false
    }
  },
  "required": ["apiVersion", "kind", "metadata", "spec"],
  "additionalProperties": false,
  "$defs": {
    "firewall_default": {
      "title": "Firewall default verdict",
      "description": "Manifest-local default verdict for a firewall traffic direction: allow or deny (spec section 44.4). Deliberately narrower than the shared runtime 'decision' def — 'approval_required' is not meaningful as a packet default; do not widen.",
      "type": "string",
      "enum": ["allow", "deny"]
    },
    "package_name": {
      "title": "Package name",
      "description": "Application package name, e.g. 'git', 'podman', '1password', 'tailscale' (spec sections 38, 46). Kept as a non-empty string: the spec pins application semantics, not a package-name grammar (section 46), and tightening later would be a breaking change.",
      "type": "string",
      "minLength": 1
    },
    "web_origin": {
      "title": "Canonical web origin",
      "type": "string",
      "pattern": "^(https://[a-z0-9](?:[a-z0-9.-]*[a-z0-9])?(?::[0-9]{1,5})?|https://\\[[0-9a-f:]+\\](?::[0-9]{1,5})?|file://)$"
    },
    "browser_string_list": {
      "type": "array",
      "maxItems": 1000,
      "items": {"type": "string", "minLength": 1, "maxLength": 2048}
    },
    "chromium_web_app_install": {
      "type": "object",
      "required": ["url"],
      "properties": {
        "url": {"type": "string", "minLength": 1, "maxLength": 2048, "pattern": "^(https://|file:///)", "not": {"pattern": "(--|\\\\|\\s)"}},
        "default_launch_container": {"enum": ["tab", "window"]},
        "create_desktop_shortcut": {"type": "boolean"},
        "fallback_app_name": {"type": "string", "minLength": 1, "maxLength": 128},
        "custom_name": {"type": "string", "minLength": 1, "maxLength": 128},
        "install_as_shortcut": {"type": "boolean"}
      },
      "additionalProperties": false
    },
    "chromium_web_app_setting": {
      "type": "object",
      "required": ["manifest_id"],
      "properties": {
        "manifest_id": {"type": "string", "minLength": 1, "maxLength": 2048},
        "run_on_os_login": {"enum": ["allowed", "blocked", "run_windowed"]},
        "prevent_close_after_run_on_os_login": {"type": "boolean"},
        "force_unregister_os_integration": {"type": "boolean"}
      },
      "additionalProperties": false
    }
  }
}
