{
  "apiVersion": "smplify.io/v1alpha1",
  "kind": "DeviceDesiredState",
  "metadata": {
    "organization": "acme",
    "device": "dev_456"
  },
  "spec": {
    "security": {
      "diskEncryption": {
        "required": true
      },
      "secureBoot": {
        "required": true
      },
      "firewall": {
        "enabled": true,
        "inboundDefault": "deny",
        "outboundDefault": "allow"
      },
      "localAdmin": {
        "policyEditing": "denied",
        "administrators": {
          "mode": "none"
        }
      }
    },
    "applications": {
      "required": [
        "git",
        "podman",
        "1password",
        "tailscale"
      ],
      "denied": [
        {
          "package": "unsafe-package"
        }
      ],
      "allowUserInstall": true
    },
    "ai": {
      "policy": "engineering-standard"
    },
    "network": {
      "privateRelay": {
        "enabled": true
      }
    },
    "update": {
      "channel": "stable"
    }
  }
}
