{
  "apiVersion": "smplify.io/v1alpha1",
  "kind": "DeviceDesiredState",
  "metadata": {
    "organization": "acme",
    "device": "dev_123"
  },
  "spec": {
    "security": {
      "diskEncryption": {
        "required": true
      },
      "secureBoot": {
        "required": true
      },
      "firewall": {
        "enabled": true,
        "inboundDefault": "deny",
        "outboundDefault": "allow"
      }
    },
    "applications": {
      "required": ["git", "podman"]
    },
    "ai": {
      "policy": "engineering-standard"
    },
    "network": {
      "privateRelay": {
        "enabled": true
      }
    },
    "update": {
      "channel": "stable"
    }
  }
}
